{
  "components" : [ {
    "interface" : false,
    "id" : "ECommerceApp.Repositories.ProductRepository",
    "files" : [ "test-for-demo/dotnet-ecommerce/src/ECommerceApp/Repositories/ProductRepository.cs" ],
    "loc" : 62,
    "tables_used" : [ ],
    "sensitive_data" : false,
    "domain" : null,
    "layer" : "Datos",
    "calls_out" : [ "ECommerceApp.Data.AppDbContext", "ECommerceApp.Repositories.IProductRepository" ],
    "calls_in" : [ ],
    "ejb_type" : null,
    "uses_jndi" : false,
    "annotations" : [ ],
    "is_interface" : false,
    "secrets_references" : [ ],
    "external_dependencies" : [ ],
    "package_dependencies" : [ ],
    "code_issues" : [ {
      "type" : "BUG_PATTERN",
      "severity" : "CRITICAL",
      "message" : "Hardcoded secret detected in variable '_dbPassword'. Use configuration or secret management instead.",
      "line" : 12,
      "pattern" : "HARDCODED_SECRET_IN_CODE"
    }, {
      "type" : "BUG_PATTERN",
      "severity" : "CRITICAL",
      "message" : "Hardcoded secret detected in variable '_cacheConnectionString'. Use configuration or secret management instead.",
      "line" : 13,
      "pattern" : "HARDCODED_SECRET_IN_CODE"
    }, {
      "type" : "BUG_PATTERN",
      "severity" : "INFO",
      "message" : "Catching generic Exception is generally discouraged. Use a more specific exception type.",
      "line" : 80,
      "pattern" : "CATCH_GENERIC_EXCEPTION"
    }, {
      "type" : "BUG_PATTERN",
      "severity" : "WARNING",
      "message" : "Empty catch block detected. Exceptions should not be swallowed.",
      "line" : 80,
      "pattern" : "EMPTY_CATCH_BLOCK"
    } ],
    "extends" : null,
    "implements" : [ "ECommerceApp.Repositories.IProductRepository" ],
    "messaging_type" : null,
    "messaging_role" : null,
    "web_type" : null,
    "web_role" : null,
    "cbo" : 5,
    "lcom" : 0.8285714285714285,
    "complexity_max" : 3,
    "complexity_avg" : 1.625
  }, {
    "interface" : true,
    "id" : "ECommerceApp.Repositories.IProductRepository",
    "files" : [ "test-for-demo/dotnet-ecommerce/src/ECommerceApp/Repositories/IProductRepository.cs" ],
    "loc" : 10,
    "tables_used" : [ ],
    "sensitive_data" : false,
    "domain" : null,
    "layer" : "Datos",
    "calls_out" : [ ],
    "calls_in" : [ "ECommerceApp.Services.ProductService", "ECommerceApp.Services.OrderService", "ECommerceApp.Repositories.ProductRepository" ],
    "ejb_type" : null,
    "uses_jndi" : false,
    "annotations" : [ ],
    "is_interface" : true,
    "secrets_references" : [ ],
    "external_dependencies" : [ ],
    "package_dependencies" : [ ],
    "code_issues" : [ ],
    "extends" : null,
    "implements" : [ ],
    "messaging_type" : null,
    "messaging_role" : null,
    "web_type" : null,
    "web_role" : null,
    "cbo" : 2,
    "lcom" : 0.0,
    "complexity_max" : 1,
    "complexity_avg" : 1.0
  }, {
    "interface" : false,
    "id" : "ECommerceApp.Repositories.OrderRepository",
    "files" : [ "test-for-demo/dotnet-ecommerce/src/ECommerceApp/Repositories/OrderRepository.cs" ],
    "loc" : 53,
    "tables_used" : [ ],
    "sensitive_data" : false,
    "domain" : null,
    "layer" : "Datos",
    "calls_out" : [ "ECommerceApp.Data.AppDbContext", "ECommerceApp.Repositories.IOrderRepository" ],
    "calls_in" : [ ],
    "ejb_type" : null,
    "uses_jndi" : false,
    "annotations" : [ ],
    "is_interface" : false,
    "secrets_references" : [ ],
    "external_dependencies" : [ ],
    "package_dependencies" : [ ],
    "code_issues" : [ {
      "type" : "BUG_PATTERN",
      "severity" : "INFO",
      "message" : "Switch statement is missing a 'default' case.",
      "line" : 53,
      "pattern" : "MISSING_SWITCH_DEFAULT"
    }, {
      "type" : "BUG_PATTERN",
      "severity" : "INFO",
      "message" : "Direct use of Console.Write/WriteLine. Use a logger (ILogger) instead.",
      "line" : 56,
      "pattern" : "CONSOLE_LOGGING"
    }, {
      "type" : "BUG_PATTERN",
      "severity" : "INFO",
      "message" : "Direct use of Console.Write/WriteLine. Use a logger (ILogger) instead.",
      "line" : 59,
      "pattern" : "CONSOLE_LOGGING"
    }, {
      "type" : "BUG_PATTERN",
      "severity" : "INFO",
      "message" : "Direct use of Console.Write/WriteLine. Use a logger (ILogger) instead.",
      "line" : 62,
      "pattern" : "CONSOLE_LOGGING"
    }, {
      "type" : "BUG_PATTERN",
      "severity" : "INFO",
      "message" : "Direct use of Console.Write/WriteLine. Use a logger (ILogger) instead.",
      "line" : 65,
      "pattern" : "CONSOLE_LOGGING"
    } ],
    "extends" : null,
    "implements" : [ "ECommerceApp.Repositories.IOrderRepository" ],
    "messaging_type" : null,
    "messaging_role" : null,
    "web_type" : null,
    "web_role" : null,
    "cbo" : 6,
    "lcom" : 0.5,
    "complexity_max" : 5,
    "complexity_avg" : 1.8333333333333333
  }, {
    "interface" : true,
    "id" : "ECommerceApp.Repositories.IOrderRepository",
    "files" : [ "test-for-demo/dotnet-ecommerce/src/ECommerceApp/Repositories/IOrderRepository.cs" ],
    "loc" : 8,
    "tables_used" : [ ],
    "sensitive_data" : false,
    "domain" : null,
    "layer" : "Datos",
    "calls_out" : [ ],
    "calls_in" : [ "ECommerceApp.Services.OrderService", "ECommerceApp.Repositories.OrderRepository" ],
    "ejb_type" : null,
    "uses_jndi" : false,
    "annotations" : [ ],
    "is_interface" : true,
    "secrets_references" : [ ],
    "external_dependencies" : [ ],
    "package_dependencies" : [ ],
    "code_issues" : [ ],
    "extends" : null,
    "implements" : [ ],
    "messaging_type" : null,
    "messaging_role" : null,
    "web_type" : null,
    "web_role" : null,
    "cbo" : 3,
    "lcom" : 0.0,
    "complexity_max" : 1,
    "complexity_avg" : 1.0
  }, {
    "interface" : false,
    "id" : "ECommerceApp.Models.Order",
    "files" : [ "test-for-demo/dotnet-ecommerce/src/ECommerceApp/Models/Order.cs" ],
    "loc" : 14,
    "tables_used" : [ "orders" ],
    "sensitive_data" : false,
    "domain" : null,
    "layer" : "Compartida",
    "calls_out" : [ ],
    "calls_in" : [ ],
    "ejb_type" : null,
    "uses_jndi" : false,
    "annotations" : [ "Table" ],
    "is_interface" : false,
    "secrets_references" : [ ],
    "external_dependencies" : [ ],
    "package_dependencies" : [ ],
    "code_issues" : [ {
      "type" : "BUG_PATTERN",
      "severity" : "WARNING",
      "message" : "Property 'Customer' uses null-forgiving operator (= null!). Consider using 'required' modifier, a default value, or making the property nullable.",
      "line" : 14,
      "pattern" : "NULL_FORGIVING_OPERATOR"
    } ],
    "extends" : null,
    "implements" : [ ],
    "messaging_type" : null,
    "messaging_role" : null,
    "web_type" : null,
    "web_role" : null,
    "cbo" : 5,
    "lcom" : 0.0,
    "complexity_max" : null,
    "complexity_avg" : null
  }, {
    "interface" : false,
    "id" : "ECommerceApp.Models.Customer",
    "files" : [ "test-for-demo/dotnet-ecommerce/src/ECommerceApp/Models/Customer.cs" ],
    "loc" : 14,
    "tables_used" : [ "customers" ],
    "sensitive_data" : false,
    "domain" : null,
    "layer" : "Compartida",
    "calls_out" : [ ],
    "calls_in" : [ ],
    "ejb_type" : null,
    "uses_jndi" : false,
    "annotations" : [ "Table" ],
    "is_interface" : false,
    "secrets_references" : [ ],
    "external_dependencies" : [ ],
    "package_dependencies" : [ ],
    "code_issues" : [ ],
    "extends" : null,
    "implements" : [ ],
    "messaging_type" : null,
    "messaging_role" : null,
    "web_type" : null,
    "web_role" : null,
    "cbo" : 2,
    "lcom" : 0.0,
    "complexity_max" : null,
    "complexity_avg" : null
  }, {
    "interface" : false,
    "id" : "ECommerceApp.Models.OrderItem",
    "files" : [ "test-for-demo/dotnet-ecommerce/src/ECommerceApp/Models/OrderItem.cs" ],
    "loc" : 15,
    "tables_used" : [ "order_items" ],
    "sensitive_data" : false,
    "domain" : null,
    "layer" : "Compartida",
    "calls_out" : [ ],
    "calls_in" : [ ],
    "ejb_type" : null,
    "uses_jndi" : false,
    "annotations" : [ "Table" ],
    "is_interface" : false,
    "secrets_references" : [ ],
    "external_dependencies" : [ ],
    "package_dependencies" : [ ],
    "code_issues" : [ {
      "type" : "BUG_PATTERN",
      "severity" : "WARNING",
      "message" : "Property 'Order' uses null-forgiving operator (= null!). Consider using 'required' modifier, a default value, or making the property nullable.",
      "line" : 14,
      "pattern" : "NULL_FORGIVING_OPERATOR"
    }, {
      "type" : "BUG_PATTERN",
      "severity" : "WARNING",
      "message" : "Property 'Product' uses null-forgiving operator (= null!). Consider using 'required' modifier, a default value, or making the property nullable.",
      "line" : 19,
      "pattern" : "NULL_FORGIVING_OPERATOR"
    } ],
    "extends" : null,
    "implements" : [ ],
    "messaging_type" : null,
    "messaging_role" : null,
    "web_type" : null,
    "web_role" : null,
    "cbo" : 2,
    "lcom" : 0.0,
    "complexity_max" : null,
    "complexity_avg" : null
  }, {
    "interface" : false,
    "id" : "ECommerceApp.Models.Category",
    "files" : [ "test-for-demo/dotnet-ecommerce/src/ECommerceApp/Models/Category.cs" ],
    "loc" : 10,
    "tables_used" : [ "categories" ],
    "sensitive_data" : false,
    "domain" : null,
    "layer" : "Compartida",
    "calls_out" : [ ],
    "calls_in" : [ ],
    "ejb_type" : null,
    "uses_jndi" : false,
    "annotations" : [ "Table" ],
    "is_interface" : false,
    "secrets_references" : [ ],
    "external_dependencies" : [ ],
    "package_dependencies" : [ ],
    "code_issues" : [ ],
    "extends" : null,
    "implements" : [ ],
    "messaging_type" : null,
    "messaging_role" : null,
    "web_type" : null,
    "web_role" : null,
    "cbo" : 2,
    "lcom" : 0.0,
    "complexity_max" : null,
    "complexity_avg" : null
  }, {
    "interface" : false,
    "id" : "ECommerceApp.Models.Product",